{
  "request": {
    "product_group": "microwave",
    "target_customer": "제출 원고 사용 상황 확인용 조사",
    "use_situation": "반복 가열 설정의 기존 지원 확인",
    "improvement_task": "간편조리·출력 선택·제조사 메뉴와 개인 설정 저장을 구분",
    "model_ids": [
      "MW23FDI"
    ],
    "dataset_version": "lg-manual-scope-20261005.2",
    "exclusions": [
      "실제 고객 리뷰 없음: 불편 빈도·수요·효과 추정 금지",
      "정의한 사례 기능 범위이며 LG 전체 기능 목록이 아님",
      "설명서에 없음은 기능 미지원의 증거가 아님",
      "다른 모델·문서 버전 근거 혼합 금지",
      "차이 2건·미확인 7건은 reference-pack sidecar에서 유지",
      "개인 설정 저장/호출 M16은 미확인; 미지원으로 단정 금지"
    ]
  },
  "product": {
    "model_id": "MW23FDI",
    "name": "LG 디오스 오브제컬렉션 전자레인지",
    "product_group": "microwave",
    "document_version": "MFL68822538 Rev.00_120925",
    "source_kind": "public"
  },
  "sources": [
    {
      "id": "MW23FDI-MANUAL-M11",
      "model_id": "MW23FDI",
      "document_version": "MFL68822538 Rev.00_120925",
      "source_kind": "public",
      "source_type": "manual",
      "source_id": "MW23FDI-manual-3ceec78295d0",
      "locator": {
        "page": 25,
        "section": "출력 조절"
      },
      "text": "버튼을 누를 때마다 1000 W ~ 800 W ~ 600 W ~ \n400 W ~ 200 W ~ 1000 W 순으로 진행표시부에 \n표시됩니다.",
      "feature_ids": [
        "MW23FDI-FEATURE-power-selection"
      ]
    },
    {
      "id": "MW23FDI-MANUAL-M14",
      "model_id": "MW23FDI",
      "document_version": "MFL68822538 Rev.00_120925",
      "source_kind": "public",
      "source_type": "manual",
      "source_id": "MW23FDI-manual-3ceec78295d0",
      "locator": {
        "page": 17,
        "section": "간편조리 시간"
      },
      "text": "2 문을 닫고 시작/선택  버튼을 세 번 누르세요.\n• 자동으로 조리가 시작됩니다.\n• 버튼을 누를 때마다 30초씩 올라가며",
      "feature_ids": [
        "MW23FDI-FEATURE-quick-time"
      ]
    },
    {
      "id": "MW23FDI-MANUAL-M15",
      "model_id": "MW23FDI",
      "document_version": "MFL68822538 Rev.00_120925",
      "source_kind": "public",
      "source_type": "manual",
      "source_id": "MW23FDI-manual-3ceec78295d0",
      "locator": {
        "page": 18,
        "section": "자동데우기 메뉴"
      },
      "text": "지정된 음식의 종류에 따라 조리시간이 기억되어 있어  \n자동으로 조리됩니다.\n1 음식물을 제품 중앙에 넣으세요.\n2 자동요리  버튼을 한 번 눌러서 자동데우기 를  \n선택하세요.\n3 시작/선택  버튼을 누르면 1-1이 진행표시부에  \n표시됩니다.\n4 시간/무게 조절  버튼(다이얼)으로 원하는 메뉴를  \n선택하세요.\n• + 버튼(다이얼): 1-1 즉석밥 ~ 1-z 국/찌개 ~  \n1-3 우유  순으로 진행표시부에 표시됩니다.",
      "feature_ids": [
        "MW23FDI-FEATURE-auto-reheating"
      ]
    }
  ],
  "features": [
    {
      "id": "MW23FDI-FEATURE-power-selection",
      "model_id": "MW23FDI",
      "document_version": "MFL68822538 Rev.00_120925",
      "name": "출력 조절",
      "description": "200/400/600/800/1000 W의 조리 출력 선택",
      "conditions": [
        "조리 출력 선택 안내이며 개인 시간/출력 조합 저장 지원 여부는 이 인용으로 미확인"
      ],
      "evidence_ids": [
        "MW23FDI-MANUAL-M11"
      ]
    },
    {
      "id": "MW23FDI-FEATURE-quick-time",
      "model_id": "MW23FDI",
      "document_version": "MFL68822538 Rev.00_120925",
      "name": "간편조리 시간",
      "description": "시작/선택 누름마다 30초 증가",
      "conditions": [
        "간편조리의 시작/선택 버튼 조작; 개인 프리셋 저장 지원 여부는 이 인용으로 미확인"
      ],
      "evidence_ids": [
        "MW23FDI-MANUAL-M14"
      ]
    },
    {
      "id": "MW23FDI-FEATURE-auto-reheating",
      "model_id": "MW23FDI",
      "document_version": "MFL68822538 Rev.00_120925",
      "name": "자동데우기 메뉴",
      "description": "제조사가 지정한 즉석밥·국/찌개·우유 메뉴",
      "conditions": [
        "제조사 지정 메뉴의 기억된 조리시간; 개인 설정 저장 지원 여부는 이 인용으로 미확인"
      ],
      "evidence_ids": [
        "MW23FDI-MANUAL-M15"
      ]
    }
  ],
  "revision_count": 0,
  "max_concepts": 3,
  "changed_evidence_ids": []
}
