{
  "request": {
    "product_group": "dishwasher",
    "target_customer": "식기세척기를 처음 사용하는 가구",
    "use_situation": "큰 냄비와 그릇을 함께 적재한다.",
    "improvement_task": "냄비 손잡이가 회전 날개에 닿는지 확인하기 어려워 중간에 다시 적재했다.",
    "exclusions": [
      "다른 모델 기능 혼용"
    ],
    "model_ids": [
      "CHANGE-DISHWASHER-MODEL"
    ],
    "dataset_version": "CHANGE-DISHWASHER-v2"
  },
  "product": {
    "model_id": "CHANGE-DISHWASHER-MODEL",
    "name": "재실행 예제용 가상 dishwasher",
    "product_group": "dishwasher",
    "document_version": "1.0",
    "source_kind": "synthetic"
  },
  "sources": [
    {
      "id": "CHANGE-DISHWASHER-REVIEW",
      "model_id": "CHANGE-DISHWASHER-MODEL",
      "document_version": "1.0",
      "source_kind": "synthetic",
      "source_type": "review",
      "source_id": "CHANGE-DISHWASHER-REVIEW-DOC",
      "locator": {
        "row": 2
      },
      "text": "냄비 손잡이가 회전 날개에 닿는지 확인하기 어려워 중간에 다시 적재했다.",
      "feature_ids": []
    },
    {
      "id": "CHANGE-DISHWASHER-MANUAL",
      "model_id": "CHANGE-DISHWASHER-MODEL",
      "document_version": "1.0",
      "source_kind": "synthetic",
      "source_type": "manual",
      "source_id": "CHANGE-DISHWASHER-MANUAL-DOC",
      "locator": {
        "page": 3,
        "section": "사용 조건"
      },
      "text": "회전 날개에 식기가 닿지 않게 배치한다. 적재 예시 그림을 제공한다.",
      "feature_ids": [
        "CHANGE-DISHWASHER-FEATURE"
      ]
    },
    {
      "id": "CHANGE-DISHWASHER-REVIEW-2",
      "model_id": "CHANGE-DISHWASHER-MODEL",
      "document_version": "1.0",
      "source_kind": "synthetic",
      "source_type": "review",
      "source_id": "CHANGE-DISHWASHER-REVIEW-DOC",
      "locator": {
        "row": 3
      },
      "text": "같은 적재 그림을 따라 놓으니 냄비 손잡이 간섭 없이 잘 세척되었다.",
      "feature_ids": []
    }
  ],
  "features": [
    {
      "id": "CHANGE-DISHWASHER-FEATURE",
      "model_id": "CHANGE-DISHWASHER-MODEL",
      "document_version": "1.0",
      "name": "설명서의 현재 지원 기능",
      "description": "회전 날개에 식기가 닿지 않게 배치한다. 적재 예시 그림을 제공한다.",
      "conditions": [
        "설명서의 사용 조건을 충족해야 함"
      ],
      "evidence_ids": [
        "CHANGE-DISHWASHER-MANUAL"
      ]
    }
  ],
  "revision_count": 0,
  "max_concepts": 3,
  "changed_evidence_ids": []
}
