{
  "request": {
    "product_group": "microwave",
    "target_customer": "가상 기획 시나리오의 가정 사용자",
    "use_situation": "가상의 반복 가열과 개인 설정 요청 상황",
    "improvement_task": "출력·기억된 메뉴·설정의 조건을 보존하고 기능 중복 여부를 대조",
    "exclusions": [
      "근거 없이 고객 불편이나 효과를 단정",
      "새 고주파 출력 모드를 제안"
    ],
    "model_ids": [
      "MW23FDI"
    ],
    "dataset_version": "lg-manual-scope-20261006.3-pm-intake"
  },
  "product": {
    "model_id": "MW23FDI",
    "name": "LG 디오스 오브제컬렉션 전자레인지",
    "product_group": "microwave",
    "document_version": "MFL68822538 Rev.00_120925",
    "source_kind": "public"
  },
  "sources": [
    {
      "id": "MW23FDI-MANUAL-M11",
      "model_id": "MW23FDI",
      "document_version": "MFL68822538 Rev.00_120925",
      "source_kind": "public",
      "source_type": "manual",
      "source_id": "MW23FDI-manual-3ceec78295d0",
      "locator": {
        "page": 25,
        "section": "출력 조절"
      },
      "text": "버튼을 누를 때마다 1000 W ~ 800 W ~ 600 W ~ \n400 W ~ 200 W ~ 1000 W 순으로 진행표시부에 \n표시됩니다.",
      "feature_ids": [
        "MW23FDI-FEATURE-power-selection"
      ]
    },
    {
      "id": "MW23FDI-MANUAL-M14",
      "model_id": "MW23FDI",
      "document_version": "MFL68822538 Rev.00_120925",
      "source_kind": "public",
      "source_type": "manual",
      "source_id": "MW23FDI-manual-3ceec78295d0",
      "locator": {
        "page": 17,
        "section": "간편조리 시간"
      },
      "text": "2 문을 닫고 시작/선택  버튼을 세 번 누르세요.\n• 자동으로 조리가 시작됩니다.\n• 버튼을 누를 때마다 30초씩 올라가며",
      "feature_ids": [
        "MW23FDI-FEATURE-quick-time"
      ]
    },
    {
      "id": "MW23FDI-MANUAL-M15",
      "model_id": "MW23FDI",
      "document_version": "MFL68822538 Rev.00_120925",
      "source_kind": "public",
      "source_type": "manual",
      "source_id": "MW23FDI-manual-3ceec78295d0",
      "locator": {
        "page": 18,
        "section": "자동데우기 메뉴"
      },
      "text": "지정된 음식의 종류에 따라 조리시간이 기억되어 있어  \n자동으로 조리됩니다.\n1 음식물을 제품 중앙에 넣으세요.\n2 자동요리  버튼을 한 번 눌러서 자동데우기 를  \n선택하세요.\n3 시작/선택  버튼을 누르면 1-1이 진행표시부에  \n표시됩니다.\n4 시간/무게 조절  버튼(다이얼)으로 원하는 메뉴를  \n선택하세요.\n• + 버튼(다이얼): 1-1 즉석밥 ~ 1-z 국/찌개 ~  \n1-3 우유  순으로 진행표시부에 표시됩니다.",
      "feature_ids": [
        "MW23FDI-FEATURE-auto-reheating"
      ]
    },
    {
      "id": "DATA003-MW23FDI-M06",
      "model_id": "MW23FDI",
      "document_version": "MFL68822538 Rev.00_120925",
      "source_kind": "public",
      "source_type": "manual",
      "source_id": "MW23FDI-manual-3ceec78295d0",
      "locator": {
        "page": 37,
        "section": "스펙·설명서 p37"
      },
      "text": "*1 고주파 출력 1000 W는 짧은 시간 사용하는 경우의 출력이며, 조리 시간이 경과함에 따라 바뀔 수 있습니다 .\n모델명 MWJ23PI, MWJ23EI, MW23FDI MWJ25PI, MWJ25EI\n정격전압 220 V~ 60 Hz\n정격 소비전력 1570 W\n정격 고주파 출력 Max. 1000 W*1",
      "feature_ids": []
    },
    {
      "id": "DATA003-MW23FDI-M07",
      "model_id": "MW23FDI",
      "document_version": "MFL68822538 Rev.00_120925",
      "source_kind": "public",
      "source_type": "manual",
      "source_id": "MW23FDI-manual-3ceec78295d0",
      "locator": {
        "page": 37,
        "section": "고지정보·설명서 p37"
      },
      "text": "모델명 MWJ23PI, MWJ23EI, MW23FDI MWJ25PI, MWJ25EI\n정격전압 220 V~ 60 Hz\n정격 소비전력 1570 W",
      "feature_ids": []
    },
    {
      "id": "DATA003-MW23FDI-M13",
      "model_id": "MW23FDI",
      "document_version": "MFL68822538 Rev.00_120925",
      "source_kind": "public",
      "source_type": "manual",
      "source_id": "MW23FDI-manual-3ceec78295d0",
      "locator": {
        "page": 17,
        "section": "간편 조리 출력 설정하기"
      },
      "text": "간편 조리 출력 설정하기 (이 기능은 모델에 따라 다를 수  \n있습니다.)\n• 간편 조리 출력은 기본적으로 700 W로 설정되어  \n있습니다.\n• 간편 조리 출력은 700 W, 1000 W 2가지로 설정할 수  \n있습니다.\n• 1000 W로 설정하려면\n1) 문을 연 상태에서 시작/선택  버튼을 약 4초간  \n누르면 700 W가 진행표시부에 표시됩니다.\n2) + 혹은 - 버튼(다이얼)으로 1000 W를 선택하세요.\n3) 시작/선택  버튼을 누르면 간편 조리 출력은 1000  \nW로 설정됩니다.",
      "feature_ids": []
    }
  ],
  "features": [
    {
      "id": "MW23FDI-FEATURE-power-selection",
      "model_id": "MW23FDI",
      "document_version": "MFL68822538 Rev.00_120925",
      "name": "출력 조절",
      "description": "200/400/600/800/1000 W의 조리 출력 선택",
      "conditions": [
        "조리 출력 선택 안내이며 개인 시간/출력 조합 저장 지원 여부는 이 인용으로 미확인"
      ],
      "evidence_ids": [
        "MW23FDI-MANUAL-M11"
      ]
    },
    {
      "id": "MW23FDI-FEATURE-quick-time",
      "model_id": "MW23FDI",
      "document_version": "MFL68822538 Rev.00_120925",
      "name": "간편조리 시간",
      "description": "시작/선택 누름마다 30초 증가",
      "conditions": [
        "간편조리의 시작/선택 버튼 조작; 개인 프리셋 저장 지원 여부는 이 인용으로 미확인"
      ],
      "evidence_ids": [
        "MW23FDI-MANUAL-M14"
      ]
    },
    {
      "id": "MW23FDI-FEATURE-auto-reheating",
      "model_id": "MW23FDI",
      "document_version": "MFL68822538 Rev.00_120925",
      "name": "자동데우기 메뉴",
      "description": "제조사가 지정한 즉석밥·국/찌개·우유 메뉴",
      "conditions": [
        "제조사 지정 메뉴의 기억된 조리시간; 개인 설정 저장 지원 여부는 이 인용으로 미확인"
      ],
      "evidence_ids": [
        "MW23FDI-MANUAL-M15"
      ]
    }
  ],
  "revision_count": 0,
  "max_concepts": 3,
  "changed_evidence_ids": []
}
