{
  "request": {
    "product_group": "dishwasher",
    "target_customer": "가상 기획 시나리오의 가정 사용자",
    "use_situation": "가상의 큰 식기 적재와 노즐 간섭 확인 상황",
    "improvement_task": "기존 적재 안내와 바구니 조절의 제약을 대조하고 추가 확인 질문을 도출",
    "exclusions": [
      "근거 없이 고객 불편이나 효과를 단정",
      "기존 바구니 높이 조절을 새로운 기능으로 제안"
    ],
    "model_ids": [
      "DUE6BGL2E"
    ],
    "dataset_version": "lg-manual-scope-20261006.3-pm-intake"
  },
  "product": {
    "model_id": "DUE6BGL2E",
    "name": "LG 디오스 오브제컬렉션 식기세척기 (빌트인/14인용)",
    "product_group": "dishwasher",
    "document_version": "MFL71959117 Rev.07_030626",
    "source_kind": "public"
  },
  "sources": [
    {
      "id": "DUE6BGL2E-MANUAL-D12",
      "model_id": "DUE6BGL2E",
      "document_version": "MFL71959117 Rev.07_030626",
      "source_kind": "public",
      "source_type": "manual",
      "source_id": "DUE6BGL2E-manual-ff60f78ab832",
      "locator": {
        "page": 20,
        "section": "식기 배열"
      },
      "text": "하단 식기 바구니에 식기 배열하기\n하단 식기 바구니는 큰 접시, 냄비, 프라이팬, 오목한 그릇 \n등 부피가 큰 식기를 세척하기에 좋습니다.\n상단 식기 바구니에 식기 배열하기\n상단 식기 바구니는 오목한 그릇, 작은 접시, 컵, 유리잔  \n등을 세척하기에 좋습니다.\n• 컵 선반에는 컵, 작은 식기 등을 놓을 수 있습니다.\n최상단 식기 바구니에 식기 배열하기\n최상단 식기 바구니는 수저류, 칼, 포크 등을 세척하기에  \n좋습니다.",
      "feature_ids": [
        "DUE6BGL2E-FEATURE-basket-assignment"
      ]
    },
    {
      "id": "DUE6BGL2E-MANUAL-D09",
      "model_id": "DUE6BGL2E",
      "document_version": "MFL71959117 Rev.07_030626",
      "source_kind": "public",
      "source_type": "manual",
      "source_id": "DUE6BGL2E-manual-ff60f78ab832",
      "locator": {
        "page": 23,
        "section": "상단 바구니 높이"
      },
      "text": "높이를 3단계로 조절",
      "feature_ids": [
        "DUE6BGL2E-FEATURE-basket-height"
      ]
    },
    {
      "id": "DUE6BGL2E-MANUAL-D13",
      "model_id": "DUE6BGL2E",
      "document_version": "MFL71959117 Rev.07_030626",
      "source_kind": "public",
      "source_type": "manual",
      "source_id": "DUE6BGL2E-manual-ff60f78ab832",
      "locator": {
        "page": 23,
        "section": "높이 조절 조건"
      },
      "text": "반드시 식기 바구니를 모두 비운 후 높이를 조절하세요.",
      "feature_ids": [
        "DUE6BGL2E-FEATURE-basket-height"
      ]
    },
    {
      "id": "DUE6BGL2E-MANUAL-D14",
      "model_id": "DUE6BGL2E",
      "document_version": "MFL71959117 Rev.07_030626",
      "source_kind": "public",
      "source_type": "manual",
      "source_id": "DUE6BGL2E-manual-ff60f78ab832",
      "locator": {
        "page": 24,
        "section": "노즐 간섭 조건"
      },
      "text": "상단 식기 바구니를 먼저 밀어 넣은 후 하단 식기  \n바구니를 밀어 넣으세요. 식기 크기가 크면 상단 노즐에 \n닿아 잘 돌아가지 않습니다.",
      "feature_ids": [
        "DUE6BGL2E-FEATURE-nozzle-clearance"
      ]
    },
    {
      "id": "DUE6BGL2E-MANUAL-D13-P24",
      "model_id": "DUE6BGL2E",
      "document_version": "MFL71959117 Rev.07_030626",
      "source_kind": "public",
      "source_type": "manual",
      "source_id": "DUE6BGL2E-manual-ff60f78ab832",
      "locator": {
        "page": 24,
        "section": "양쪽 높이 확인"
      },
      "text": "식기 바구니의 양쪽 높이가 동일한지 확인한 후 제품  \n안쪽으로 밀어 넣으세요.",
      "feature_ids": [
        "DUE6BGL2E-FEATURE-basket-height"
      ]
    },
    {
      "id": "DUE6BGL2E-MANUAL-D14-P20",
      "model_id": "DUE6BGL2E",
      "document_version": "MFL71959117 Rev.07_030626",
      "source_kind": "public",
      "source_type": "manual",
      "source_id": "DUE6BGL2E-manual-ff60f78ab832",
      "locator": {
        "page": 20,
        "section": "상단 바구니 없는 세척 금지"
      },
      "text": "상단 식기 바구니를 제품에서 빼낸 상태에서 식기를  \n세척하지 마세요.",
      "feature_ids": [
        "DUE6BGL2E-FEATURE-nozzle-clearance"
      ]
    },
    {
      "id": "DATA003-DUE6BGL2E-D03",
      "model_id": "DUE6BGL2E",
      "document_version": "MFL71959117 Rev.07_030626",
      "source_kind": "public",
      "source_type": "manual",
      "source_id": "DUE6BGL2E-manual-ff60f78ab832",
      "locator": {
        "page": 57,
        "section": "스펙 / 제품 사이즈; 설명서 p57 DUE 빌트인 열"
      },
      "text": "모델명 DFE6**E, DFE6***E DUE6**E, DUE6***E, DUE6****E, \nDEE6**E\n제품 타입 프리스탠딩 빌트인\n전원 220 V, 60 Hz\n최대 용량 14인용\n수압 0.05 MPa ~ 1.0 MPa\n소비 전력 1600 W\n제품 크기\n(폭 X 높이 X 깊이)\n598 mm X 845 mm X 600 mm\n598 mm X 815 mm X 567 mm (상판 제거 시) 598 mm X 815 mm X 567 mm",
      "feature_ids": []
    }
  ],
  "features": [
    {
      "id": "DUE6BGL2E-FEATURE-basket-assignment",
      "model_id": "DUE6BGL2E",
      "document_version": "MFL71959117 Rev.07_030626",
      "name": "식기 배열",
      "description": "하단 큰 식기·냄비, 상단 작은 식기·컵, 최상단 수저류",
      "conditions": [
        "공용 DUE6****E 설명서의 바구니별 식기 배치 안내"
      ],
      "evidence_ids": [
        "DUE6BGL2E-MANUAL-D12"
      ]
    },
    {
      "id": "DUE6BGL2E-FEATURE-basket-height",
      "model_id": "DUE6BGL2E",
      "document_version": "MFL71959117 Rev.07_030626",
      "name": "상단 바구니 높이",
      "description": "높이를 3단계로 조절",
      "conditions": [
        "식기 바구니를 모두 비운 뒤 높이 조절(p23); 양쪽 높이 동일 확인(p24)"
      ],
      "evidence_ids": [
        "DUE6BGL2E-MANUAL-D09",
        "DUE6BGL2E-MANUAL-D13",
        "DUE6BGL2E-MANUAL-D13-P24"
      ]
    },
    {
      "id": "DUE6BGL2E-FEATURE-nozzle-clearance",
      "model_id": "DUE6BGL2E",
      "document_version": "MFL71959117 Rev.07_030626",
      "name": "노즐 간섭 조건",
      "description": "상단 바구니를 먼저 넣고 큰 식기가 상단 노즐 회전을 가리는지 확인",
      "conditions": [
        "상단 바구니를 빼낸 상태에서 세척하지 않음(p20)"
      ],
      "evidence_ids": [
        "DUE6BGL2E-MANUAL-D14",
        "DUE6BGL2E-MANUAL-D14-P20"
      ]
    }
  ],
  "revision_count": 0,
  "max_concepts": 3,
  "changed_evidence_ids": []
}
